id,question1_en,question2_en,question2_fr,is_duplicate
646,I'm transferring to a school with a US curriculum (taking the IBDP) from a Philippine school w/ a percent average grading system. How do I get my GPA?,"I am in tenth grade at a high school in Ontario, Canada. I would really love to do an exchange with a student from Europe. Any ideas on how I can go about doing this?","Je suis en dixième année dans une école secondaire en Ontario, au Canada. J'aimerais vraiment faire un échange avec un étudiant d'Europe. Des idées sur la façon dont je peux y arriver?",0
647,How do I make money with YouTube?,How do I make money through YouTube?,Comment gagner de l'argent via YouTube?,1
648,How do I find love in life?,How do I find the love of my life?,Comment puis-je trouver l'amour de ma vie?,1
649,"Which option is better to reduce weight, swimming or gym?","Is it possible to burn 1000 calories each day? If yes, how?","Est-il possible de brûler 1000 calories chaque jour? Si oui, comment?",0
650,Is there any way to get rid of gynecomastia?,How can I get rid of man boobs?,Comment puis-je me débarrasser des seins d'homme?,1
651,Which payment gateway in Saudi that using to collect and pay money from/to multiple ?,"Which are all the stress free, relatively easy to get jobs in India that pay a decent sum of money and allow you to pursue other interests?","Quels sont tous les emplois sans stress, relativement faciles à obtenir en Inde qui paient une somme décente et vous permettent de poursuivre d'autres intérêts?",0
652,Are there any scientific reasons behind Hindu temples?,What is the scientific reason behind visiting temples?,Quelle est la raison scientifique derrière la visite des temples?,1
653,Is (male) circumcision required in Islam?,Is circumcision allowed in Islam?,La circoncision est-elle autorisée dans l'islam?,0
654,Where can I get super high quality photos for any photo booth services in Sydney?,Where can I get professional photo booths service in Sydney?,Où puis-je obtenir un service de photomaton professionnel à Sydney?,1
655,How can I find out whom I sent a friend request to on Instagram?,How do you send a friend request on Instagram?,Comment envoyez-vous une demande d'ami sur Instagram?,0
656,How can I control on my anger?,How can someone control their anger?,Comment quelqu'un peut-il contrôler sa colère?,1
657,What are genders?,What is Gender Profiling?,Qu'est-ce que le profilage de genre?,0
658,How do I get off Quora?,How do get out of Quora?,Comment sortir de Quora?,1
659,How long can raw and cooked sausage last refrigerated?,How long does onigiri last if left refrigerated? How can it be kept longer?,Combien de temps dure l'onigiri s'il est laissé réfrigéré? Comment peut-il rester plus longtemps?,0
660,What are the best available smartphones gadgets?,What are some of the best smartphones technology gadgets?,Quels sont les meilleurs gadgets technologiques des smartphones?,1
661,How does it feel to be a closeted gay in India?,How does it feel to be homosexual in India?,Ça fait quoi d'être homosexuel en Inde?,1
662,Can we switch roles at Amazon?,How important is the role of TPM at Amazon?,Quelle est l'importance du rôle de TPM chez Amazon?,0
663,What happens if dictatorship is continuing in the present days?,What happens if a dictatorship continues in the present day?,Que se passe-t-il si une dictature se poursuit aujourd'hui?,1
664,What makes a great cup of coffee great?,What makes a perfect cup of coffee?,Qu'est-ce qui fait une tasse de café parfaite?,1
665,Is the US election rigged?,Was the US election rigged?,Les élections américaines ont-elles été truquées?,1
666,Why hasn't Gayle Laakmann McDowell/careercup created a MOOC or a coding bootcamp?,"Is Gayle Laakmann McDowell planning on publishing any more books? If so, what is she working on?","Gayle Laakmann McDowell envisage-t-elle de publier d'autres livres? Si oui, sur quoi travaille-t-elle?",0
667,What is fermentation? What are some products of fermentation?,What are some fermented products?,Quels sont les produits fermentés?,0
668,"What do you think about my short film, ""ColorShift""?",What do you think about my short film?,Que penses-tu de mon court métrage?,0
669,Should there be a war between India and Pakistan for Kashmir?,Why is there a conflict between India and Pakistan on Kashmir?,Pourquoi y a-t-il un conflit entre l'Inde et le Pakistan sur le Cachemire?,0
670,What is the best way to get you food stamp card?,How can I get food stamps in college?,Comment puis-je obtenir des bons alimentaires à l'université?,0
671,"What are some real world example of encapsulation and abstraction and how are they different, yet related?",What are some examples of recursion in the real world?,Quels sont quelques exemples de récursivité dans le monde réel?,0
672,What are ways to deal with fabricate security and insurance of android application?,How do find best applications for android security?,Comment trouver les meilleures applications pour la sécurité Android?,0
673,What is the best accordion for beginners to learn on?,How difficult would it be to learn how to play the accordion if I know how to play the piano?,À quel point serait-il difficile d'apprendre à jouer de l'accordéon si je sais jouer du piano?,0
674,Role of junior leaders in Indian army?,What is the role of the Indian army?,Quel est le rôle de l'armée indienne?,0
675,What's your opinion about the decision on removal of 500 and 1000 rupees currency notes?,What is the use of demonetizing Rs. 500 & Rs. 1000 notes?,Quelle est l'utilisation de la démonétisation Rs. 500 & Rs. 1000 notes?,1
676,What are some of the most mind-blowing facts about Bengaluru?,What are some interesting facts about Bengaluru?,Quels sont les faits intéressants sur Bengaluru?,1
677,"If both the parents have blood group B+, can the child have A+?",If both my parents have blood group B+ can I be A+?,Si mes deux parents ont le groupe sanguin B + puis-je être A +?,0
678,Which book is best for Neet chemistry?,Which is the best book for chemistry for NEET?,Quel est le meilleur livre de chimie pour NEET?,1
679,What is the essence of enlightenment?,What is enlightenment?,Qu'est-ce que l'illumination?,0
680,Why are so many questions posted to Quora that are so easily answered by using Google?,Why do many Quora users ask questions they could look up online?,Pourquoi de nombreux utilisateurs de Quora posent-ils des questions qu'ils pourraient consulter en ligne?,1
681,How should I answer if an interviewer asks me to sell a pen or any other product as I am pursuing a MBA?,What should be the answer if your interviewer asks you to sell his pen in front of him?,Quelle devrait être la réponse si votre interlocuteur vous demande de vendre son stylo devant lui?,0
682,What are some great side dishes for a minestrone soup?,"68.44% of product passes the process spec.To pass, the product must be close to average. How many standard deviations away does 68.44% represent?","68,44% du produit est conforme aux spécifications du processus. Pour réussir, le produit doit être proche de la moyenne. Combien d'écarts-types de distance représentent 68,44%?",0
683,How much is the maximum gold you can take when flying from India to USA?,Why don't we fly east to go from India to USA?,Pourquoi ne volons-nous pas vers l’est pour aller de l’Inde aux États-Unis?,0
684,"If my reservation status is RAC, does it mean the seat has been confirmed?","My family tickets have changed from RAC to CNF (Confirmed), will all of us have adjacent seats? After preparation of charts?","Mes billets de famille sont passés de RAC à CNF (Confirmé), allons-nous tous avoir des sièges adjacents? Après préparation des cartes?",0
685,How does a new website protect its design and user interface from copycats?,What is a way to design a beautiful user interface?,Comment concevoir une belle interface utilisateur?,0
686,How can I improve my skills?,How do I improve my learning skills?,Comment puis-je améliorer mes compétences d'apprentissage?,0
687,Is it possible to use SPI between AVR and Raspberry pi?,What are the uses of Raspberry Pi and Intel Galileo?,Quelles sont les utilisations de Raspberry Pi et Intel Galileo?,0
688,Which are the best movies of 2016?,What is your best 2016 movie?,Quel est votre meilleur film 2016?,1
689,What would be effect of 500 and 1000 Rs notes ban?,"Why Central Govt banned old 500 and 1000 Rs note, but issued new 500 and 2000 Rs note?","Pourquoi Central Govt a-t-il banni les vieux billets de 500 et 1000 R, mais a publié une nouvelle note de 500 et 2000 Rs?",1
690,What are some of the best photos?,What is a good photo?,Qu'est-ce qu'une bonne photo?,0
691,Why students run away from home?,Why do people run away from home?,Pourquoi les gens fuient-ils de chez eux?,0
692,"In C++, what are access modifiers?",What are access modifiers in Java?,Quels sont les modificateurs d'accès en Java?,0
693,"Can you analyze history, or is it unscientific?","Can poetry be learned? Or is it a “you have it or not"" sort of thing?",Peut-on apprendre la poésie? Ou est-ce un genre de chose que vous avez ou pas?,0
694,What are some interesting theories about life after death?,What is the truth about life after death since there are some unconfirmed examples?,Quelle est la vérité sur la vie après la mort puisqu'il existe des exemples non confirmés?,0
695,Do I need to get a tetanus shot again?,Do I need to get a tetanus shot?,Dois-je me faire vacciner contre le tétanos?,0
696,How light bend with gravity?,"If gravity bends light, can light bend gravity?","Si la gravité plie la lumière, la lumière peut-elle plier la gravité?",1
697,What does it mean to hike up your skirt?,What are some cute ways to cut up a skirt?,Quelles sont quelques façons mignonnes de couper une jupe?,0
698,How many new cars are sold by Maserati in the US each year?,Has Lotus actually sold any cars in the US over the last 10 year?,Lotus a-t-il effectivement vendu des voitures aux États-Unis au cours des 10 dernières années?,0
699,How do you send a private message to someone you're following on Quora?,How do I send another person a message on Quora?,Comment envoyer un message à une autre personne sur Quora?,1
700,How do you train a white Pitbull with brown spots?,How do I train White Pitbulls?,Comment former des White Pitbulls?,1
701,What is the difference between a turkey and a chicken?,"Why does turkey have darker, more flavorful dark meat than chicken?",Pourquoi la dinde a-t-elle une viande plus foncée et plus savoureuse que le poulet?,0
702,What are some of the most surreal questions asked on Quora?,What is the most surreal question on Quora?,Quelle est la question la plus surréaliste sur Quora?,1
703,What is the difference between IT and computer science engineering?,What are the differences between computer science and computer engineering?,Quelles sont les différences entre l'informatique et le génie informatique?,0
704,When will the best time for having sex?,What would be the best time to have sex?,Quel serait le meilleur moment pour avoir des relations sexuelles?,1
705,How can I consult a good free online astrologer?,Are there any good free online astrologers?,Y a-t-il de bons astrologues en ligne gratuits?,1
706,Why we don't feel sympathy towards everyone?,Why don't I feel like talking to anyone?,Pourquoi n'ai-je pas envie de parler à quelqu'un?,0
707,Why do brothers hate sisters?,Why do we hate our sisters?,Pourquoi détestons-nous nos sœurs?,1
708,What is the best site for downloading Kannada films in torrent form?,What's a good torrent site to download games from?,Qu'est-ce qu'un bon site de torrent pour télécharger des jeux?,0
709,What are some of the most gruesome causes of death?,What causes death by hanging?,Qu'est-ce qui cause la mort par pendaison?,0
710,What is latency in telecom?,How does WiFi latency compare to Wired Ethernet?,Comment la latence WiFi se compare-t-elle à l’Ethernet filaire?,0
711,Is senior residency at Hindu Rao Hospital teaching experience?,I am studying BS Computer science. I am in 7th semester and can't pass the basic programming course. Wasted alot money?,J'étudie l'informatique BS. Je suis au 7ème semestre et ne peux pas passer le cours de programmation de base. Gaspillé beaucoup d'argent?,0
712,What behavioral adaptations do pandas have?,What behavioral adaptations do red pandas have?,Quelles sont les adaptations comportementales des pandas rouges?,0
713,Is Textile Engineering Good?,Is textile engineering good or not?,L'ingénierie textile est-elle bonne ou non?,1
714,What is the fastest production car?,What is the world's fastest street legal car?,Quelle est la voiture la plus rapide au monde?,0
715,How magnets are made?,What are magnets made of?,De quoi sont faits les aimants?,0
716,What's the street value of A332?,What is true value?,Quelle est la vraie valeur?,0
717,What are the qualifications for being an FBI or CIA agent?,What does it take to become an FBI agent?,Que faut-il pour devenir un agent du FBI?,0
718,What is the best operating system for the PC in 2014?,What is the best operating system for PC?,Quel est le meilleur système d'exploitation pour PC?,0
719,Why are major Indian TV channels absent in northeast?,How many TV channels are there in the world?,Combien de chaînes de télévision y a-t-il dans le monde?,0
720,Hypothetical scenario: Our actual credit card system & banking never existed before. How would you implement a digital currency on the Internet today?,What are some inventions from the Neolithic Age?,Quelles sont les inventions du néolithique?,0
721,How does Quora quickly mark questions as needing improvement?,Why does Quora mark my questions as needing improvement/clarification before I have time to give it details? Literally within seconds…,Pourquoi Quora marque-t-il mes questions comme devant être améliorées / clarifiées avant d’avoir le temps de lui donner des détails? Littéralement en quelques secondes ...,1
722,How will I contact a good hacker?,How can I hire a hacker?,Comment puis-je engager un pirate informatique?,1
723,What are the best horror novel in 2016?,What are some of the best horror novels of 2014?,Quels sont les meilleurs romans d'horreur de 2014?,0
724,What is the most beautiful thing that you have ever seen?,What is the most beautiful thing ever built?,Quelle est la plus belle chose jamais construite?,0
725,What are the most important things for living a good life?,Why should I live?,Pourquoi devrais-je vivre?,0
726,What is the meaning and purpose to life?,What is the exact meaning of life?,Quel est le sens exact de la vie?,1
727,What should I do when my friends betray me?,What can I do when my friend betrayed me?,Que puis-je faire quand mon ami m'a trahi?,1
728,I'm 15 year old my height is 5 feet 7 inches and my weight is 50 kg what should I do to gain weight?,"I am 22, my weight is 46 kg and my height is 5.4 ft. What should I do to gain height and weight?","J'ai 22 ans, mon poids est de 46 kg et ma taille est de 5,4 pieds. Que dois-je faire pour gagner de la taille et du poids?",1
729,Why is Saltwater taffy candy imported in China?,Why is Saltwater taffy candy imported in Laos?,Pourquoi les bonbons à la tire d'eau salée sont-ils importés au Laos?,1
730,Is there a different price over the Internet than in person when trying to book a room in Mexico City from the US?,Why is Mexico City dangerous?,Pourquoi Mexico City est-elle dangereuse?,0
731,Why did Venuetastic fail?,How much does it cost to book a good wedding venue?,Combien coûte la réservation d'un bon lieu de mariage?,0
732,"Which were some of the most amazing responses you have got with Cortana, Siri or Amazon Echo?",What are some of the most amazing concepts given by theoretical physicists which cannot be proved in reality or are too advanced to prove with available resources/technologies?,Quels sont certains des concepts les plus étonnants donnés par les physiciens théoriciens qui ne peuvent pas être prouvés dans la réalité ou sont trop avancés pour prouver avec les ressources / technologies disponibles?,0
733,What is most important in life - money or values?,What is more important money or respect?,Qu'est-ce que l'argent plus important ou le respect?,0
734,Who are the best hackers in India?,Who is best Indian hacker?,Qui est le meilleur hacker indien?,1
735,Should the Indian education system be changed?,Do we need to change the  education system of India? If yes then why?,Avons-nous besoin de changer le système éducatif de l'Inde? Si oui alors pourquoi?,1
736,What are the multiple uses of hollow columns?,What is the standard size of a column for building?,Quelle est la taille standard d'une colonne pour la construction?,0
737,Which are some commonly mispronounced words?,What are some of the most commonly mispronounced English words?,Quels sont les mots anglais les plus souvent mal prononcés?,0
738,Why is it that every teen girl has a crush on her mathematics teacher? Is it the intelligence or their behavior?,Do girls get crushes on their male teachers?,Les filles ont-elles des coups de cœur pour leurs professeurs masculins?,0
739,Is it too late to go to medical school and become a doctor?,Is it too late to go to medical school at 24?,Est-il trop tard pour aller à l'école de médecine à 24 ans?,1
740,Where can I buy best quality commercial innerspring sofa bed in Chatswood West?,Where can I get quality services for cleaning paint and paint removal in Chatswood?,Où puis-je obtenir des services de qualité pour le nettoyage des peintures et des enlèvements de peinture à Chatswood?,0
741,"If you screenshot someone's Instagram video, will they get notified that you screenshotted it?",If I screenshot someone's live video on Instagram do they get notified?,"Si je capture une vidéo en direct sur Instagram, est-ce qu'ils reçoivent une notification?",0
742,"What government exams, other than the GATE, can final year computer science students give?","What government exams, other than the GATE can average mark final year computer science students give?","Quels examens du gouvernement, autres que le GATE, peuvent en moyenne attribuer aux étudiants en informatique de dernière année?",1
743,What sentences use all 26 letters without any repeats?,"Pangrams: In English, using all the letters of the alphabet exactly once, and picking one dictionary, can you make a sentence, or any set of common English words?","Pangrams: En anglais, en utilisant toutes les lettres de l'alphabet exactement une fois, et en choisissant un dictionnaire, pouvez-vous faire une phrase ou un ensemble de mots anglais communs?",0
744,What is the effect of hypodensity of white matter in parietal lobe of brain?,How do I increase grey matter in the brain?,Comment augmenter la matière grise dans le cerveau?,0
745,What is your job and your salary? Are you satisfied with your current job?,My IQ is currently 83. Can I get a high paying job or ever get a six figure salary job?,Mon QI est actuellement de 83. Puis-je obtenir un emploi bien rémunéré ou obtenir un emploi rémunéré à six chiffres?,0
746,Psychopaths: Do you find babies cute?,Do psychopaths find babies cute?,Les psychopathes trouvent-ils les bébés mignons?,1
747,What is the opera song with a choir used for horror movies?,"What are an opera choir's rights? Do we get paid for rehearsals? Are we entitled to catering throughout rehearsals, etc. (part of an opera company)?","Quels sont les droits d'une chorale d'opéra? Est-ce qu'on est payé pour les répétitions? Avons-nous droit à la restauration pendant les répétitions, etc. (partie d'une compagnie d'opéra)?",0
748,Would a woman in the Catholic Church be shunned or ostracized for having a sexual relationship with a priest?,What would happen if a woman sued the Catholic Church for not allowing them to become a priest?,Que se passerait-il si une femme poursuivait l'Église catholique pour ne pas leur permettre de devenir prêtre?,0
749,"If a Canadian gets a tattoo in America, do they have to declare the cost when returning to Canada?",I'm a Canadian PR that just finished studying in the US. I got offered an H1-B. Should I take the offer or return to Canada?,Je suis un PR canadien qui vient de terminer ses études aux États-Unis. On m'a offert un H1-B. Devrais-je prendre l'offre ou retourner au Canada?,0
750,How can I see who blocked me at Facebook?,Will I see if someone blocked me of Facebook?,Vais-je voir si quelqu'un m'a bloqué sur Facebook?,1
751,Why has there been a scarcity of high quality fantasy films?,Briefly describe how you would test a mineral for each of these properties?,Décrivez brièvement comment vous testeriez un minéral pour chacune de ces propriétés?,0
752,Who are some of great coders from Tamil Nadu?,Are there any competitive coders from Tamil Nadu?,Y a-t-il des codeurs compétitifs du Tamil Nadu?,1
753,What do think of when you hear the word elect?,"What do you think when you hear the word, ""Japan""?","Que pensez-vous quand vous entendez le mot ""Japon""?",0
754,Which is the best programming language to learn in 2017?,How should you start learning programming?,Comment devriez-vous commencer à apprendre la programmation?,0
755,What is the ultimate way to serve humanity?,How can one serve humanity?,Comment peut-on servir l'humanité?,1
756,How can I calculate 72 hours from now?,How do I calculate a semester percentage from SGPA in ITER?,Comment calculer un pourcentage de semestre à partir de SGPA dans ITER?,0
757,How hard was it for Jimmy Wales to immigrate to the UK?,Why does Jimmy Wales choose to reside in London instead of the US?,Pourquoi Jimmy Wales choisit-il de résider à Londres plutôt qu'aux États-Unis?,0
758,Cochin to London etihad is the change over time of 1hr sufficient in Dubai?,What is difference between China and the United States to send gifts?,Quelle est la différence entre la Chine et les États-Unis pour envoyer des cadeaux?,0
759,What is Quora's algorithm for sorting answers to a single question?,How does the ranking of answers on Quora work?,Comment fonctionne le classement des réponses sur Quora?,0
760,What will be the resolution one should have for the year 2016?,What's your resolution for year 2016?,Quelle est votre résolution pour l'année 2016?,1
761,What are Balaji Viswanathan's views on caste based reservations in India?,What is Balaji Vishwanathan's view on caste based reservation system in India?,Quel est le point de vue de Balaji Vishwanathan sur le système de réservation basé sur les castes en Inde?,1
762,Jawed habib haircut prices?,DO YOU THINK IF MY TREE FALLS ON YOUR PROPERTY IT SHOULD BE MYINE OR YOUR RESPONSABILITY?,PENSEZ-VOUS SI MON ARBRE TOMBE SUR VOTRE PROPRIÉTÉ IL DOIT ÊTRE MYINE OU VOTRE RESPONSABILITÉ?,0
763,Does any one have ebook of answers of wren and Martin grammer and composition?,Why did barvaria join Germany?,Pourquoi barvaria a-t-elle rejoint l'Allemagne?,0
764,What is [math]x[/math] if [math]x+\left(\dfrac{1}{x}\right) =0[/math]?,What is [math]\mathop {\lim}\limits_{x \to 0^+}\frac{1}{x}^\frac{-x}{x+1}[/math]?,Qu'est-ce que [math] \ mathop {\ lim} \ limits_ {x \ à 0 ^ +} \ frac {1} {x} ^ \ frac {-x} {x + 1} [/ math]?,0
765,Whenever its about “her” its a very special feeling. Tried hard to forget her but she's alwys spcl. Should I stop talking to her even as a friend ?,How should I stop thinking about someone?,Comment devrais-je arrêter de penser à quelqu'un?,0
766,What are Mutual funds? How do they work?,What is mutual fund all about?,Qu'est-ce que le fonds mutuel?,1
767,How has the vertebral column anatomy changed through time?,"When calculating bullet spin; MV X 12 (twist rate in inches) X 60=RPM, does distance to target matter?","Lors du calcul du spin de balle; MV X 12 (taux de torsion en pouces) X 60 = RPM, la distance par rapport à la cible est-elle importante?",0
768,Which acoustic bass guitar is the best?,How do you go about maintaining an acoustic bass guitar?,Comment allez-vous entretenir une basse acoustique?,0
769,Which universities in the US offer more management content in the management information systems curriculum?,Which universities in the US offer a more technical content in the management information systems curriculum?,Quelles universités aux États-Unis offrent un contenu plus technique dans le programme de systèmes d’information de gestion?,0
770,My maths have become extremely weak and I am in class 12th. How can I improve my maths so that I can clear my JEE exams next year?,"I want to do a BBA. I only got 62% in class 12 (non maths). I am taking 1 year drop for the entrance exam of Symbiosis, GGSIPU, etc. Should I also give an improvement next year?","Je veux faire un BBA. Je n'ai que 62% en classe 12 (non mathématique). Je prends une année de moins pour le concours d'entrée de Symbiose, GGSIPU, etc. Dois-je aussi apporter une amélioration l'année prochaine?",0
771,"What is a ""function"" in the context of functional programming?",What is functional programming?,Qu'est-ce que la programmation fonctionnelle?,0
772,What is the main difference between socialism and communism.?,"What is the difference between socialism, marxism, and communism?","Quelle est la différence entre le socialisme, le marxisme et le communisme?",1
773,How do I change my Facebook password?,How can I log in Facebook without password?,Comment puis-je me connecter à Facebook sans mot de passe?,1
774,How is the word 'valiant' used in a sentence?,How is the word 'contorted' used in a sentence?,Comment le mot «contorsionné» est-il utilisé dans une phrase?,0
775,Why I feel dizzy when I am playing some 3D games but others do not make me feel like this? Are there any tricks in developing 3D games to avoid this?,3D Rad: How can I make a mission-based game?,3D Rad: Comment puis-je créer un jeu basé sur la mission?,0
